{
  "blueprint_slug": "theokit-arch-gaps-investigation",
  "blueprint_path": "/home/paulo/Projetos/usetheo/theokit-tools/theokit/.claude/knowledge-base/discoveries/blueprints/theokit-arch-gaps-investigation-blueprint.md",
  "blueprint_version": null,
  "scored_at": "2026-06-06T09:00:38.665996+00:00",
  "research_coverage_score": 100.0,
  "reference_citations_score": 100.0,
  "blueprint_completeness_score": 100.0,
  "risco_estrutural_score": 76.0,
  "active_dimensions": [
    "research_coverage",
    "reference_citations",
    "blueprint_completeness",
    "structural_risk"
  ],
  "weight_normalization_factor": 1.0,
  "weighted_avg": 96.4,
  "hard_caps_triggered": [],
  "final_score_after_caps": 96.4,
  "verdict": "SHIPPABLE",
  "calibration": {
    "status": "PROVISIONAL_v1",
    "holdout_count": 0,
    "holdout_target": 30,
    "kappa_measured": false
  },
  "reasons": {
    "research_coverage": {
      "contributors": [
        "Corner 'tests' populated",
        "Corner 'deps' populated",
        "Corner 'tools' populated"
      ],
      "detractors": []
    },
    "reference_citations": {
      "contributors": ["45 verified .claude/knowledge-base/references/ citation(s)"],
      "detractors": []
    },
    "blueprint_completeness": {
      "contributors": ["10/10 mandatory sections present", "5 ADR(s) found in ADRs section"],
      "detractors": []
    },
    "structural_risk": {
      "contributors": [],
      "detractors": ["weak_imperatives: 4 hits", "vague_pronouns: 3 hits", "non_verifiable: 1 hits"]
    }
  },
  "sub_reports": {
    "research_coverage": {
      "corners_populated": 4,
      "corners_total": 4,
      "corners_status": [
        {
          "corner": "tests",
          "present": true,
          "populated": true
        },
        {
          "corner": "deps",
          "present": true,
          "populated": true
        },
        {
          "corner": "tools",
          "present": true,
          "populated": true
        },
        {
          "corner": "techniques",
          "present": true,
          "populated": true
        }
      ],
      "empty_corners": [],
      "contributors": [
        "Corner 'tests' populated",
        "Corner 'deps' populated",
        "Corner 'tools' populated"
      ],
      "detractors": []
    },
    "reference_citations": {
      "total": 45,
      "verified": 45,
      "fabricated": 0,
      "explicitly_blocked": 0,
      "fabricated_paths": [],
      "blocked_paths": [],
      "word_count": 8788,
      "citation_density_per_200w": 1.02,
      "contributors": ["45 verified .claude/knowledge-base/references/ citation(s)"],
      "detractors": []
    },
    "blueprint_completeness": {
      "total_required": 10,
      "found": 10,
      "present": [
        "Header",
        "Context",
        "Objective",
        "Coverage Corner 1",
        "Coverage Corner 2",
        "Coverage Corner 3",
        "Coverage Corner 4",
        "Cross-cutting Comparison",
        "ADRs",
        "Recommendations"
      ],
      "missing_mandatory": [],
      "adr_count": 5,
      "contributors": ["10/10 mandatory sections present", "5 ADR(s) found in ADRs section"],
      "detractors": []
    },
    "structural_risk": {
      "total_hits": 9,
      "by_category": {
        "non_verifiable": 1,
        "subjective_adjectives": 1,
        "vague_pronouns": 3,
        "weak_imperatives": 4
      },
      "total_penalty": -24
    }
  }
}
